video_id,title,fetched_date
qKGLIQBoH9Q,🔴LIVE : EGYPT vs NIGERIA | Friendly Match eFootball PES 21 Simulation Gameplay PC,2025-12-18
dTG69lbLCqM,NEW BARISTUTA LOW SCREAMER PACK OPENING +GAMEPLAY 🔥 eFootball 25 mobile,2025-12-18
ZNvlOFxNk4U,NOOB VS PRO: DEER CULT HOUSE BUILD CHALLENGE in Minecraft 99 Nights in a Forest!,2025-12-18
JLUApGVQqOU,Wayyo Allah Na II,2025-12-18
WpC3vvKZA5M,Prof BOF Reveals a HIDDEN SUPER OFFENSIVE FORMATION FOR GUARANTEED GOALS!🤯[Quick Counter & LBC],2025-12-18
VNrZrm2h1Ww,Gidan Badamasi | Zango Na 7 | Trailer | AREWA24,2025-12-18
