video_id,title,fetched_date
feVB_Ct6F2E,King Of Lamba - Latest Yoruba Movie 2026 Drama Official Trailer. Will be showing tomorrow 4Pm ,2026-02-20
i6w7O1kwuBk,House of the Dragon Season 3 | Official Teaser | HBO Max,2026-02-20
v_PCBcSwIDQ,"Finally Free Neymar Blitz Curler 🤩| Review | Best Training, Skills & Goals🔥",2026-02-20
lcvUGs3xaDM,Peaky Blinders: The Immortal Man | Official Trailer | Netflix,2026-02-20
_XY5wUDdLAE,Prof BOF gets BLACK ANIMATION🤯Show time ATTACK TRIGGER LUCKIEST Pack Opening Ever!,2026-02-20
yKnP08Xoci4,I Got My Own Rebirth In Steal a Brainrot…,2026-02-20
A9LvfTuq9-o,Oogun Omo Mi Yoruba Movie 2026 | Official Trailer | Showing Tomorrow On ApataTV+,2026-02-20
DcPZdjSKD9Q,Tyler Perry’s Beauty in Black: Season 2 | Part 2 Official Trailer | Netflix,2026-02-20
EfipS03Ew_c,BAYERN MUNICH vs BORUSSIA DORTMUND Rebuild Showdown!,2026-02-20
dZuV4QKTUwI,HAUWA latest Yoruba Movie 2026 | Official Trailer |Showing this Saturday 21st on kemitystudio,2026-02-20
qmPyZe4wHSo,I TOTALLY FIX FREE BLITZ CURLER SANTOS NEYMAR…🤯| HE IS UNSTOPPABLE 🪄 ,2026-02-20
ZE2aBNeyqQw,Who Is Your Guy? (Remix),2026-02-20
