video_id,title,fetched_date
yht0d9hg0e4,Ile Odun Tuntun Yoruba Movie 2025 | Official Trailer | Showing Tomorrow On Yorubaplus,2025-12-23
Rym_-hjbf4I,Mali v Zambia | Match in 3 | Africa Cup of Nations Morocco 2025,2025-12-23
Mzw2ttJD2qQ,The Odyssey | Official Trailer,2025-12-23
BwdMT-OiARI,Black Clover Second Season | Official Trailer 2 | Crunchyroll,2025-12-23
MOeTlQt31MM,"FAST & FURIOUS 11 (2026) - First Trailer | Vin Diesel, Cristiano Ronaldo | FAN TRAILER",2025-12-23
dewQqS0Oaj4,âœ¨Swallowed Star EP203 [MULTI SUB],2025-12-23
bTDjsHInc9E,Dauda Kahutu Rarara (SHEHI ABALOYIN OF YORUBA LAND) official music 2025,2025-12-23
Gfazve_AHlU,ğŸ˜‚ç§¦ç‰§å¤§å‹ç¿»è½¦ç°åœºï¼é­”æ—ä¸¾å®¶æ¬è¿ï¼ğŸ˜ˆã€ç‰§ç¥è®° Tales of Herding Godsã€‘EP62 è¶…å‰é¢„å‘Š #animation #3danimation #åŠ¨æ¼« | æ„Ÿè°¢è®¢é˜…,2025-12-23
