video_id,title,fetched_date
zDLgcX0aQoI,Free Fire Clash Cup Nigeria - LAN Grand Finals 🇳🇬,2026-02-09
7dugE32yreI,Best Friends in the World: The Year Between (New Movie Trailer),2026-02-09
63cigWIxLLw,I PLAYED EFOOTBALL MOBILE WITH A CONTROLLER AND IT WAS FUN !,2026-02-09
4zPg7as4Sr4,I Could Get Sacked…,2026-02-09
f7jO1Q44i6Q," LAGOS TO GOMORRAH | official Trailer | Laugh, Reflect & Be Challenged!",2026-02-09
caWXwE4WlvQ,Shoday - OBT (Official Video) ft. BhadBoi OML,2026-02-09
mJ1tVmTEhgs,A STING OF PAIN | OFFICIAL TRAILER | BIMBO ADEMOYE | ANTHONY WOODE | TUNDE OLADIMEJI,2026-02-09
LDVhPqRlKro,SCC FINAL: Magnus vs. Alireza For The Speed Chess Crown! Hikaru v. Denis For Third Place Match!,2026-02-09
I_bW43tXyzk,I Fused Me & Emma Into One Brainrot...,2026-02-09
VoqjnU_wGJM,Supergirl | Home,2026-02-09
wJ67tHPtNZs,"Hytale, But Every Drop is Random...",2026-02-09
0JWQirDSUBY,Omo Abuke 2 Yoruba Movie 2026 | Official Trailer | Showing Tuesday On ApataTV+,2026-02-09
_IDO1emktBw,AFRICA CHAMPIONSHIP CIRCUIT | PRO LEAGUE - DAY 1,2026-02-09
JX1M1drH0Bc,Walk On Water (Live),2026-02-09
3prDl4Qk3JU,"I Pretended to be a NOOB, Then used a 0.01% ULTRA BIKE (Roblox Bike Obby)",2026-02-09
